{
  "id": "px68k",
  "name": "PX68k",
  "category": "emulator",
  "homepage": "https://github.com/libretro/px68k-libretro",
  "sources": [
    {
      "type": "docs",
      "url": "https://docs.libretro.com/library/px68k/",
      "last_reviewed": "2026-04-30",
      "confidence": "medium"
    }
  ],
  "platforms": [
    "windows",
    "linux",
    "macos",
    "steamdeck"
  ],
  "systems": [
    "x68000"
  ],
  "paths": {
    "content": "Content path or launcher target managed by the selected frontend",
    "saves": "Emulator-specific save/config location; do not assume a portable default"
  },
  "supported_formats": {
    "content": [
      ".dim",
      ".xdf",
      ".hdf",
      ".2hd",
      ".d88",
      ".m3u",
      ".zip",
      ".7z"
    ],
    "disc": [
      ".dim",
      ".xdf",
      ".hdf",
      ".2hd",
      ".d88"
    ],
    "descriptors": [
      ".m3u"
    ]
  },
  "library_behavior": {
    "retroarch_core": true,
    "standalone": false,
    "safe_archive_deletion_requires_launch_test": true,
    "launch_target_sensitive": false
  },
  "notes": [
    "Sharp X68000 RetroArch core. BIOS files required."
  ]
}
