{"id":"mame_2003","name":"MAME 2003","category":"emulator","homepage":"https://github.com/libretro/mame2003-libretro","sources":[{"type":"homepage","url":"https://github.com/libretro/mame2003-libretro","last_reviewed":"2026-04-29","confidence":"medium"}],"platforms":["windows","linux","macos","steamdeck"],"systems":["arcade","mame","mame2003"],"paths":{"roms":"RetroArch content directory or frontend ROM path","system":"RetroArch system directory for samples/BIOs where applicable"},"supported_formats":{"arcade":[".zip",".7z"]},"library_behavior":{"romset_version_sensitive":true,"target_romset":"MAME 0.78-era sets","do_not_unzip_roms_by_default":true,"parent_clone_model":true},"quirks":["mame-romset-version"],"notes":["Legacy libretro arcade core. Keep ZIP sets intact and preserve parent/clone relationships."]}
