{"id":"desmume","name":"DeSmuME","category":"emulator","homepage":"https://desmume.org/","sources":[{"type":"homepage","url":"https://desmume.org/","last_reviewed":"2026-04-29","confidence":"medium"}],"platforms":["windows","linux","macos","steamdeck"],"systems":["ds","nds"],"paths":{"bios":"optional DS BIOS/firmware path","config":"DeSmuME settings"},"supported_formats":{"rom":[".nds",".zip",".7z"]},"library_behavior":{"bios_optional_for_accuracy":true,"safe_archive_deletion_requires_launch_test":true},"notes":["Nintendo DS emulator/core; firmware handling is user-managed."]}
