{"id":"quasi88","name":"QUASI88","category":"emulator","homepage":"https://github.com/libretro/quasi88-libretro","sources":[{"type":"homepage","url":"https://github.com/libretro/quasi88-libretro","last_reviewed":"2026-04-29","confidence":"medium"}],"platforms":["windows","linux","macos","steamdeck"],"systems":["pc88"],"paths":{"content":"PC-8801 disk/tape/image path","system":"BIOS/font ROM path where required"},"supported_formats":{"media":[".d88",".u88",".cmt",".t88",".zip",".7z"]},"library_behavior":{"bios_required_by_setup":true,"font_rom_sensitive":true,"disk_order_sensitive":true},"notes":["PC-88 BIOS/font ROM handling must remain manual. Preserve disk order and boot/config assumptions."]}
