{
  "id": "stone_soup",
  "name": "Stone Soup",
  "category": "source_port",
  "homepage": "https://github.com/libretro",
  "sources": [
    {
      "type": "github",
      "url": "https://github.com/libretro",
      "last_reviewed": "2026-04-30",
      "confidence": "low"
    },
    {
      "type": "docs",
      "url": "https://docs.libretro.com/meta/core-list/",
      "last_reviewed": "2026-04-30",
      "confidence": "medium"
    }
  ],
  "platforms": [
    "windows",
    "linux",
    "macos",
    "steamdeck"
  ],
  "systems": [
    "ports"
  ],
  "paths": {
    "content": "Content path or launcher target managed by the selected frontend",
    "saves": "Emulator-specific save/config location; do not assume a portable default"
  },
  "supported_formats": {
    "content": [
      ".pak",
      ".zip"
    ],
    "disc": [],
    "descriptors": []
  },
  "library_behavior": {
    "retroarch_core": true,
    "standalone": false,
    "safe_archive_deletion_requires_launch_test": true,
    "launch_target_sensitive": true
  },
  "notes": [
    "Static recognition entry added from public frontend/core coverage. Verify exact launch behavior for the target frontend before repair automation."
  ]
}
