{"id":"emuscv","name":"Emuscv","category":"emulator","homepage":"https://github.com/libretro","sources":[{"type":"github","url":"https://github.com/libretro","last_reviewed":"2026-04-29","confidence":"low"}],"platforms":["windows","linux","macos","steamdeck"],"systems":["scv"],"paths":{"content":"Content path or launcher target managed by the selected frontend","saves":"Emulator-specific save/config location; do not assume a portable default"},"supported_formats":{"content":["frontend-configured"]},"library_behavior":{"retroarch_core":true,"standalone":false,"safe_archive_deletion_requires_launch_test":true},"notes":["Static recognition entry added from public frontend/core coverage. Verify exact launch behavior for the target frontend before repair automation."]}
