{"id":"jgenesis","name":"Jgenesis","category":"emulator","homepage":"https://github.com/libretro","sources":[{"type":"github","url":"https://github.com/libretro","last_reviewed":"2026-04-30","confidence":"low"}],"platforms":["windows","linux","macos","steamdeck"],"systems":["html5"],"paths":{"content":"Content path or launcher target managed by the selected frontend","saves":"Emulator-specific save/config location; do not assume a portable default"},"supported_formats":{"content":[".html",".htm",".zip",".url",".webarchive"],"disc":[],"descriptors":[]},"library_behavior":{"retroarch_core":false,"standalone":true,"safe_archive_deletion_requires_launch_test":true,"launch_target_sensitive":false},"notes":["Static recognition entry added from public frontend/core coverage. Verify exact launch behavior for the target frontend before repair automation."]}
