{"id":"vkquake","name":"vkQuake","category":"source_port","homepage":"https://github.com/Novum/vkQuake","sources":[{"type":"github","url":"https://github.com/Novum/vkQuake","last_reviewed":"2026-04-30","confidence":"medium"}],"platforms":["windows","linux","macos","steamdeck"],"systems":["quake"],"paths":{"content":"Content path or launcher target managed by the selected frontend","saves":"Emulator-specific save/config location; do not assume a portable default"},"supported_formats":{"content":[".pak",".pk3",".pk4",".zip"],"disc":[],"descriptors":[]},"library_behavior":{"retroarch_core":false,"standalone":true,"safe_archive_deletion_requires_launch_test":true,"launch_target_sensitive":true},"notes":["Modern Vulkan Quake source port."]}
