{
  "id": "bsnes_accuracy",
  "name": "bsnes Accuracy",
  "category": "emulator",
  "homepage": "https://github.com/libretro",
  "sources": [
    {
      "type": "docs",
      "url": "https://docs.libretro.com/library/bsnes_accuracy/",
      "last_reviewed": "2026-04-30",
      "confidence": "medium"
    }
  ],
  "platforms": [
    "windows",
    "linux",
    "macos",
    "steamdeck"
  ],
  "systems": [
    "snes"
  ],
  "paths": {
    "content": "SNES ROM path"
  },
  "supported_formats": {
    "roms": [
      ".sfc",
      ".smc",
      ".bs",
      ".zip",
      ".7z"
    ]
  },
  "library_behavior": {
    "special_chip_sensitive": true,
    "save_state_sensitive": true,
    "satellaview_bios_sensitive": true
  },
  "notes": [
    "Legacy bsnes accuracy core bucket. Preserve ROM/header state and do not store optional BIOS files."
  ]
}
