{
  "id": "a7800",
  "name": "A7800",
  "category": "emulator",
  "homepage": "https://github.com/7800-devtools/a7800",
  "sources": [
    {
      "type": "homepage",
      "url": "https://github.com/7800-devtools/a7800",
      "last_reviewed": "2026-04-29",
      "confidence": "high"
    }
  ],
  "platforms": [
    "windows",
    "linux",
    "steamdeck"
  ],
  "systems": [
    "atari5200",
    "atari7800"
  ],
  "paths": {
    "roms": "Configured Atari 5200/7800 ROM paths",
    "bios": "Machine BIOS/firmware path where required"
  },
  "supported_formats": {
    "roms": [
      ".a78",
      ".bin",
      ".rom",
      ".zip",
      ".7z"
    ]
  },
  "library_behavior": {
    "machine_firmware_sensitive": true,
    "folder_based": false,
    "save_state_sensitive": true
  },
  "notes": [
    "Do not store BIOS/firmware files. Validate paths and extensions only; preserve saves and emulator config."
  ]
}
