{
  "id": "gpsp",
  "name": "gpSP",
  "category": "emulator",
  "homepage": "https://docs.libretro.com/library/gpsp/",
  "sources": [
    {
      "type": "docs",
      "url": "https://docs.libretro.com/library/gpsp/",
      "last_reviewed": "2026-04-29",
      "confidence": "medium"
    }
  ],
  "platforms": [
    "windows",
    "linux",
    "macos",
    "android",
    "steamdeck"
  ],
  "systems": [
    "gba"
  ],
  "paths": {
    "system": "RetroArch system directory",
    "config": "core options"
  },
  "supported_formats": {
    "cartridge": [
      ".gba",
      ".zip",
      ".7z"
    ]
  },
  "library_behavior": {
    "supports_m3u": false,
    "bios_required_for_disc_systems": false,
    "cli_or_frontend_wrapper_common": true
  },
  "quirks": [
    "retroarch-system-dir-confusion"
  ],
  "notes": [
    "GBA core often expects optional or required BIOS depending on configuration."
  ]
}
