{
  "id": "flashpoint",
  "name": "Flashpoint Archive",
  "category": "launcher",
  "homepage": "https://flashpointarchive.org",
  "sources": [
    {
      "type": "homepage",
      "url": "https://flashpointarchive.org",
      "last_reviewed": "2026-04-29",
      "confidence": "high"
    }
  ],
  "platforms": [
    "windows",
    "linux",
    "macos"
  ],
  "systems": [
    "flash",
    "shockwave",
    "html5"
  ],
  "paths": {
    "launcher": "Flashpoint launcher/library root",
    "data": "Curated game data and technology runtimes",
    "saves": "Runtime-specific save/cache locations"
  },
  "supported_formats": {
    "web": [
      ".swf",
      ".html",
      ".htm",
      "folder",
      ".zip"
    ],
    "launchers": [
      ".url",
      ".lnk",
      ".desktop"
    ]
  },
  "library_behavior": {
    "managed_library": true,
    "runtime_bundle_sensitive": true,
    "requires_launcher_database": true,
    "safe_archive_deletion_requires_launch_test": true
  },
  "notes": [
    "Treat Flashpoint as a managed launcher/archive. Do not rewrite its database, runtimes, or cached game data from generic audits."
  ]
}
